{
  "schema_version": 1,
  "pipeline": "fast",
  "telemetry_run_id": "20260101-abcdef12",
  "started_at": "2026-01-01T00:00:00Z",
  "finished_at": "2026-01-01T00:00:01Z",
  "repo_revision": "deadbeef",
  "success": true,
  "failed_step": null,
  "input_artifacts": {
    "manifest": {
      "relpath": "assets/evolution-manifest.json",
      "sha256": "0000000000000000000000000000000000000000000000000000000000000000",
      "bytes": 42
    },
    "candidates": {
      "relpath": "assets/evolution-candidates.json",
      "missing": true
    }
  },
  "otel_semantics": {
    "hint_version": 1,
    "span_name_field": "otel_span_name",
    "notes": "fixture"
  },
  "ai_overlay_step": {
    "schema_version": 1,
    "finished_at": "2026-01-01T00:00:00+08:00",
    "mode": "llm",
    "source_run_id": "20260101-example-run",
    "provider_kind": "openai_compatible",
    "model": "gpt-4o-mini",
    "duration_ms": 1234.5,
    "prompt_chars": 8000,
    "usage": {
      "prompt_tokens": 100,
      "completion_tokens": 20,
      "total_tokens": 120
    },
    "otel_hints": {
      "note": "Semantic attribute names follow OpenTelemetry gen-ai conventions (usage).",
      "attributes": {
        "gen_ai.usage.input_tokens": 100,
        "gen_ai.usage.output_tokens": 20,
        "gen_ai.usage.total_tokens": 120
      }
    },
    "error": null,
    "dead_letter_relpath": null
  },
  "steps": [
    {
      "id": "analysis_engine_check",
      "otel_span_name": "evolution.pipeline.fast.analysis_engine_check",
      "argv": ["/usr/bin/python3", "scripts/analysis_engine.py", "--check"],
      "duration_ms": 12.5,
      "exit_code": 0,
      "stderr_tail": ""
    }
  ]
}
